{"schema_version":"1.0","task_id":"TASK-0001","decision_unit_id":"DU-001","goal":"Define task schema","inputs":["MVP design"],"planned_actions":["create schema"],"impact_scope":[".ai/schemas/task.schema.json"],"reversibility":"reversible","verification_methods":["pytest"],"external_side_effects":[],"permission_requirements":[]}
